{
  "$schema": "./tools/image-gen/manifest.schema.json",
  "outputDir": "public/assets/images/site",
  "globalStyle": "STYLE — Photoreal industrial photography. Cinematic lighting, shallow depth of field where appropriate. Palette: deep navy + cool steel + a precise lime-green accent (#a3e635) used SPARINGLY as a single small indicator/stripe per scene. Premium B2B editorial aesthetic (Caterpillar, Siemens Energy, Cummins corporate visuals). Sharp, not over-stylised.\n\nBRAND CONTEXT — Enfrio is an Italian manufacturer of high-performance engine cooling systems for two markets only: (1) power generation (stationary gensets, mission-critical primary and backup power), (2) datacenter cooling (modular heat-rejection towers). Cores are ALWAYS aluminium (never copper). Enfrio does NOT serve automotive, off-highway, or earthmoving.\n\nABSOLUTE RULES (never violate):\n- NO logos, NO watermarks, NO readable text, NO signage of any kind.\n- NO recognisable faces. Operators are shown from behind, in profile blur, hands-only, or face hidden by PPE.\n- NO third-party OEM brand names anywhere.\n- Lime green is an ACCENT only — one small LED, one floor stripe, one indicator.\n\nNO_INVENTION RULE — CRITICAL — Do NOT draw any Enfrio cooling product from memory or imagination. The ONLY Enfrio products that may appear in the output are the ones shown in the attached source/reference image(s). Each attached image is the absolute canon: the product must appear in the output IDENTICAL to its reference — same silhouette, same internal details, same proportions, same components. Do NOT redesign, restyle, simplify, modernise or stylise. If the references do not show a particular Enfrio product, that product must NOT appear in the output.\n\nFAILURE_MODE RULE — If you cannot place a reference product into the scene with full fidelity, OMIT the product entirely and output the scene without any cooling unit — just the environment, with the spot empty or atmospheric. DO NOT substitute a generic, fantasy or invented cooler. An empty scene is fully acceptable; an invented product is NOT.\n\nM-TOWER SCENES — When the source/reference image is `mtower-render.png`, that file IS the only canonical M-Tower module in the world. The model must STRUCTURALLY 1:1-copy the reference. Locked structural elements (do NOT alter, do NOT redesign, do NOT simplify): tall rectangular vertical envelope and its proportions; front protection mesh grid (the dotted screen visible on three faces); structural steel frame with welded gussets at the corners; side inverter cabinet on the right with its door + accessory panel; internal fan modules visible from the rear; rubber vibration-isolation pads at the base; number, position and shape of every component visible. NEVER invent any other M-Tower-like object. For scenes that need multiple M-Towers in a row, render only 1-2 units sharp in the foreground (1:1 copies of the reference), let the others fall into atmospheric haze / depth-of-field blur so rendering imperfections are hidden.\n\nM-TOWER QUALITY — Quality of the render IS expected to improve. The CAD source is plain — you SHOULD push it to photoreal: realistic matte powder-coated black steel materials, anodised aluminium mesh texture, brushed metal cabinet, proper key/fill/rim lighting with soft shadows, accurate reflections on mesh and cabinet, micro-detail on welds and bolts, atmospheric integration with the scene, one small lime-green status LED on the cabinet. Improve rendering, never restructure.\n\nRADIATOR SCENES — When the source is a real photo of an Enfrio radiator / cooling unit, treat its tube pitch and spacing, fin pattern, header-tank shape, side reinforcement frame, mounting brackets, fan shroud architecture, hose/connection layout as a LOCKED engineering reference. Do NOT modify any structural element. You MAY freely modify: ambient light direction and quality, background environment, surface highlights, colour grade, atmospheric haze. You must strip all third-party logos and brand markings visible in the source.\n\nAMBIENT / PROCESS SCENES — When no Enfrio product is identifiable in the source (just operator + machinery), refine editorially: preserve operator pose, hand position, machinery geometry. Strip every brand marking. Operator faces must be obscured or out of frame. The output must NOT contain any identifiable Enfrio cooling product in foreground — keep machinery, operators, process elements only.",
  "defaults": {
    "model": "gpt-image-1",
    "size": "1536x1024",
    "quality": "medium"
  },
  "images": [
    {
      "filename": "hero-main.jpg",
      "mode": "i2i",
      "sourcePath": "public/assets/images/site/hero-main.jpg",
      "size": "1536x1024",
      "quality": "high",
      "prompt": "TEMPLATE B — radiator i2i. ROLE: homepage hero (split layout, image right). CHANGES: cinematic side-key + soft fill, deepen background to out-of-focus factory shadow, push grade to cool teal/steel with warm orange weld-arc glow on the visor, add subtle spark bokeh, one small lime rim on the shoulder. Strip every logo. COMPOSITION: 16:9, sharp on welding hand and core, operator face hidden by mask."
    },
    {
      "filename": "prod-line.jpg",
      "mode": "i2i",
      "sourcePath": "public/assets/images/site/prod-line.jpg",
      "size": "1536x1024",
      "quality": "medium",
      "prompt": "TEMPLATE B — radiator i2i. ROLE: homepage 'Inside Enfrio' dominant — production line in active manufacturing. CHANGES: single volumetric light shaft from the ceiling, soften background to factory bokeh, cool industrial grade with one warm task lamp. Plain unbranded dark blue workwear. Strip every brand marking from machinery and walls. COMPOSITION: 3:2, slight low-angle, foreground unit sharp."
    },
    {
      "filename": "tube-bending-operator.jpg",
      "mode": "i2i",
      "sourcePath": "public/assets/images/site/tube-bending-operator.jpg",
      "size": "1536x1024",
      "quality": "high",
      "prompt": "TEMPLATE C — ambient/process (no specific Enfrio product visible). ROLE: homepage carousel + /technology process-step — '6-axis tube bending'. CHANGES: rim-light the cell interior, deepen shadows, neutral industrial steel grade, sharpen the tube curvature, tiny motion blur on the hand. Strip every brand marking from the machine. COMPOSITION: 3:2, hands and tube as hero, operator face hidden by helmet."
    },
    {
      "filename": "assembly-worker.jpg",
      "mode": "i2i",
      "sourcePath": "public/assets/images/site/assembly-worker.jpg",
      "size": "1024x1536",
      "quality": "medium",
      "prompt": "TEMPLATE C — ambient/process. ROLE: homepage tall-shot + /company. CHANGES: clean three-point lighting, hands tack-sharp on the aluminium fins, operator face slightly out of focus or in profile, cool blue-grey palette with one warm task lamp. COMPOSITION: 2:3 portrait."
    },
    {
      "filename": "rad-engine-complete.jpg",
      "mode": "i2i",
      "sourcePath": "public/assets/images/site/rad-engine-complete.jpg",
      "size": "1536x1024",
      "quality": "medium",
      "prompt": "TEMPLATE B — radiator i2i. ROLE: homepage cluster + /solutions cluster — engine with Enfrio cooling package integrated. CHANGES: pure dark studio background (#0a0e15), single softbox key from upper-left, accent rim along the cooling fins to make aluminium gleam, soft floor reflection. Strip every visible OEM badge from the engine block. COMPOSITION: 16:9, three-quarter view."
    },
    {
      "filename": "power-gen-hall.jpg",
      "mode": "i2i",
      "sourcePath": "public/assets/images/site/mtower-render.png",
      "size": "1536x1024",
      "quality": "high",
      "prompt": "TEMPLATE A — M-Tower scene. The attached reference is the only canonical M-Tower. Every cooling tower in the output must be a 1:1 copy of this reference (no inventions). ROLE: flagship Power Generation — homepage spotlight + /industries hero/card + /tower-m deploy card. SCENE: interior of a massive power-generation hall. 6 large industrial diesel gensets aligned in a row down the hall; each genset has 1 M-Tower module (the reference) installed directly above/behind it (1 genset = 1 M-Tower, the modular philosophy). Polished concrete floor reflecting overhead industrial lighting. NO PEOPLE. LIGHT: deep teal-navy ambient + cool ceiling LEDs, one warm accent on the closest unit. Lime-green status LED visible on each M-Tower inverter cabinet. COMPOSITION: 3:2, low-angle, vanishing point at the end of the hall. Sharp on the first M-Tower + genset pair, others fall into atmospheric haze."
    },
    {
      "filename": "welder-action.jpg",
      "mode": "i2i",
      "sourcePath": "public/assets/images/site/welder-action.jpg",
      "size": "1536x1024",
      "quality": "medium",
      "prompt": "TEMPLATE B — radiator i2i. ROLE: homepage + /company carousel — 'Fabrication Precision'. CHANGES: REMOVE every logo and brand mark in the background (critical fix on this shot). Replace background with out-of-focus factory bokeh, deep navy ambient. Dramatic warm orange arc-glow on the visor; cool blue rim everywhere else. Sharp on welding hands and the core. COMPOSITION: 3:2, welder in profile or three-quarter-back, face hidden by mask."
    },
    {
      "filename": "handwork-detail.jpg",
      "mode": "i2i",
      "sourcePath": "public/assets/images/site/handwork-detail.jpg",
      "size": "1536x1024",
      "quality": "medium",
      "prompt": "TEMPLATE B — radiator i2i. ROLE: homepage carousel + /technology — 'Hands-on Quality' macro. CHANGES: extreme close-up macro, sharp focus on a single fin and a calloused thumb, everything else creamy bokeh. Cool neutral grade with a hint of warm skin tone. COMPOSITION: 3:2, fingers + aluminium dominate, no operator face."
    },
    {
      "filename": "team-office-floor.jpg",
      "mode": "t2i",
      "size": "1536x1024",
      "quality": "high",